{
  "@type": "ada:VNMIRSpectralPoint",
  "ada:detector": "MCT",
  "ada:beamsplitter": "KBr",
  "ada:calibrationStandards": "gold mirror",
  "ada:numberOfScans": 256,
  "ada:spectralRangeMin": "400",
  "ada:spectralRangeMax": "4000",
  "ada:spectralResolution": "4 cm-1",
  "ada:spectralSampling": "2 cm-1",
  "ada:spotSize": "100 micrometer",
  "ada:measurement": "reflectance",
  "ada:measurementEnvironment": "ambient",
  "ada:environmentalPressure": 1013.25,
  "ada:sampleHeated": false,
  "ada:sampleTemperature": 25,
  "ada:vacuumExposedSample": false,
  "ada:emissionAngle": 0.0,
  "ada:incidenceAngle": 30.0,
  "ada:phaseAngle": 30.0,
  "ada:uncertaintyNoise": 0.002
}